{
  "id": "deck",
  "name": "SaaS Onboarding Walkthrough",
  "cards": [
    {
      "id": "card-1",
      "title": "Welcome & sign in",
      "notes": "Set the stage: who this is for and what they'll have working by the end. Sign in with the demo account so the audience sees a real, populated workspace — not an empty shell.\n\n- One line on the problem CueDeck-for-SaaS solves for {{customer}}\n- Sign in, land on the workspace home",
      "snippets": [
        {
          "id": "card-1-snippet-1",
          "label": "Demo email",
          "content": "{{demoEmail}}"
        },
        {
          "id": "card-1-snippet-2",
          "label": "Demo password",
          "content": "hunter2-demo-only"
        }
      ]
    },
    {
      "id": "card-2",
      "title": "Create your workspace",
      "notes": "Show the empty state first (it's honest and relatable), then create the workspace live. Name it after the customer so the rest of the demo feels bespoke.",
      "snippets": [
        {
          "id": "card-2-snippet-1",
          "label": "Workspace slug",
          "content": "{{workspace}}"
        }
      ]
    },
    {
      "id": "card-3",
      "title": "Invite a teammate",
      "notes": "Collaboration is the hook for most SaaS buyers. Send one invite and call out that seats are self-serve. Don't dwell — this is a 20-second beat.",
      "snippets": [
        {
          "id": "card-3-snippet-1",
          "label": "Teammate email",
          "content": "teammate@{{customer}}.example"
        },
        {
          "id": "card-3-snippet-2",
          "label": "Invite message",
          "content": "Hey — added you to the {{customer}} workspace so we can set this up together."
        }
      ]
    },
    {
      "id": "card-4",
      "title": "Connect a data source",
      "notes": "This is the \"aha\" moment: real data flowing in. Connect the source, show the sync status go green. Have the connection string on the clipboard so there's zero fumbling.",
      "snippets": [
        {
          "id": "card-4-snippet-1",
          "label": "Data source",
          "content": "{{dataSource}}"
        },
        {
          "id": "card-4-snippet-2",
          "label": "Connection string",
          "content": "postgres://demo:***@analytics-prod.{{customer}}.internal:5432/analytics"
        }
      ]
    },
    {
      "id": "card-5",
      "title": "See your first insight",
      "notes": "Pay off the data connection immediately. Open the auto-generated dashboard and narrate one number that would matter to {{customer}}. End on the value, not the UI.",
      "snippets": [
        {
          "id": "card-5-snippet-1",
          "label": "Sample metric",
          "content": "Weekly active accounts"
        }
      ]
    },
    {
      "id": "card-6",
      "title": "Next steps",
      "notes": "Recap the three things they just did: created a workspace, connected data, saw an insight. Offer the obvious next action (start a trial / book a rollout call) and open the floor for questions.",
      "snippets": []
    }
  ],
  "createdAt": "2000-01-01T00:00:00.000Z",
  "updatedAt": "2000-01-01T00:00:00.000Z",
  "schemaVersion": 2,
  "variables": {
    "customer": "Acme",
    "demoEmail": "ada@acme.example",
    "workspace": "acme-hq",
    "dataSource": "Postgres (analytics-prod)"
  }
}
